label,media,date,longText,major,important,gaming,drawing,collab,video
【Minecraft】 END EXPLORATION,https://i3.ytimg.com/vi/jj4yfUwRV-I/maxresdefault.jpg,7/23/2021,"The hunt for ender cities begin! Will you find an end ship and acquire an elytra for yourself? Spoiler: There was an end ship, alright. Not too sure about the elytra.",FALSE,FALSE,TRUE,FALSE,FALSE,https://www.youtube.com/watch?v=jj4yfUwRV-I
【Resident Evil 7: Biohazard】 W-W-WAH 【#1】,https://i3.ytimg.com/vi/mzR5CjLXZtE/maxresdefault.jpg,7/26/2021,"The start of horror game week, featuring the much beloved Resident Evil 7: Biohazard! There's nothing quite like shooting at people while wildly exclaiming ""Let's talk!"" is there?",FALSE,FALSE,TRUE,FALSE,FALSE,https://www.youtube.com/watch?v=mzR5CjLXZtE
【CHAT】 Summer Time! Tako Time!...and?,https://i3.ytimg.com/vi/Ua6udlJdsKE/maxresdefault.jpg,8/4/2021,"The last stream before your summer ""break!"" But you have something special in store for us...",FALSE,TRUE,FALSE,FALSE,FALSE,https://www.youtube.com/watch?v=Ua6udlJdsKE
『VIOLET』 - Ninomae Ina'nis,https://i3.ytimg.com/vi/8ZdLXELdF9Q/maxresdefault.jpg,8/4/2021,"It was teased for a few months, but the day finally came. The wait was absolutely worth it! Your very first original song! And you sound amazing! And the background track is amazing! And the art is amazing, and so is the MV! And-",TRUE,TRUE,FALSE,FALSE,FALSE,https://www.youtube.com/watch?v=8ZdLXELdF9Q
【CHAT】 I'M BACK!!!!,https://i3.ytimg.com/vi/F83AOHeRtIA/maxresdefault.jpg,8/12/2021,"We welcome you back from your week break! Although break is probably too generous of a word... You reveal to us some more lore, and a sneak peak of ACOUSTIC VIOLET!",FALSE,TRUE,FALSE,FALSE,FALSE,https://www.youtube.com/watch?v=F83AOHeRtIA
【Gartic Phone】 HoloENana Phone,https://i3.ytimg.com/vi/qPPTKLi9uw8/maxresdefault.jpg,8/12/2021,"The first HoloMyth and Project: HOPE full collab! Featuring beautiful drawings from all EN members, with a special fluffy surprise at the end!",TRUE,TRUE,TRUE,FALSE,TRUE,https://www.youtube.com/watch?v=qPPTKLi9uw8
【Minecraft】 END EXPLORATION Pt.2,https://i3.ytimg.com/vi/S630gqcJ0CQ/maxresdefault.jpg,8/13/2021,...Glad the end ship wasn't cut in half this time. You now have your very own elytra! Isn't it amazing just how high and fast you can soar with it?,FALSE,FALSE,TRUE,FALSE,FALSE,https://www.youtube.com/watch?v=S630gqcJ0CQ
【Ender Lilies】 Begin! 【#1】,https://i3.ytimg.com/vi/1fOMSWjxsAw/maxresdefault.jpg,8/17/2021,Your very first Ender Lilies stream! You seem to really enjoy these types of games now!,FALSE,FALSE,TRUE,FALSE,FALSE,https://www.youtube.com/watch?v=1fOMSWjxsAw
【THE WONDERFUL 101】 TAKODACHIS UNITE...UNLIMITED...FORM? 【#6】,https://i3.ytimg.com/vi/60AzXNCJIgk/maxresdefault.jpg,8/20/2021,The final Wonderful 101 stream... UNITE TAKO!,FALSE,FALSE,TRUE,FALSE,FALSE,https://www.youtube.com/watch?v=60AzXNCJIgk
【TTRPG & Gartic Phone】 HUNTERS PARTY HARD with GARTIC PHONE,https://i3.ytimg.com/vi/n7VGI7x9F0s/maxresdefault.jpg,8/24/2021,"The first full ""TTRPG"" stream on your channel--but it turned into a fun chatting and Gartic Phone stream!",FALSE,FALSE,TRUE,FALSE,TRUE,https://www.youtube.com/watch?v=n7VGI7x9F0s
【Mario Kart 8DX Tournament】 LET'S GET DOWN TO BUSINESS EN x ID Tournament!!,https://i3.ytimg.com/vi/Tw5Ft4VDkfk/maxresdefault.jpg,8/27/2021,Your training arc paid off--you show off your incredible tako drifting and win the first full EN x ID tournament collab! Just how powerful can one priestess be!?,FALSE,FALSE,TRUE,FALSE,TRUE,https://www.youtube.com/watch?v=Tw5Ft4VDkfk
【It Takes Two】 Hope for Teamwork!! 【#1】,https://i3.ytimg.com/vi/Uykz_Q3-Kq4/maxresdefault.jpg,8/27/2021,The beginning of something special... hopefully you won't get divorced!,FALSE,FALSE,TRUE,FALSE,TRUE,https://www.youtube.com/watch?v=Uykz_Q3-Kq4
Fan Expo Boston 2021,https://cdn.discordapp.com/attachments/884983162768330783/886494569590558740/E66ZO7NX0AU03zJ.png,9/3/2021,"Your latest convention appearance at Boston--this time with Ame and Kiara to enjoy your company as you have another Q&A session, and some more convention merch!",TRUE,TRUE,FALSE,FALSE,TRUE,https://fanexpohq.com/fanexpoboston/fan-expo-boston-x-hololive-en-2021-vtuber-tour/
【Ender Lilies】 Tiro Finale! 【#5】,https://i3.ytimg.com/vi/DmmRtze0KKE/maxresdefault.jpg,9/4/2021,TIRO FINALE! You completed Ender Lilies with flying colors!,FALSE,FALSE,TRUE,FALSE,FALSE,https://www.youtube.com/watch?v=DmmRtze0KKE
【DRAWING】 TakoEats Beauty Division,https://i3.ytimg.com/vi/CpbCaWmyLdE/maxresdefault.jpg,9/9/2021,A fun drawing stream in which you design new hairstyles for all of HoloMyth!,FALSE,FALSE,FALSE,TRUE,FALSE,https://www.youtube.com/watch?v=CpbCaWmyLdE
【It Takes Two】 Hope 3.33 【#3】,https://i3.ytimg.com/vi/fxixCZU5aoY/maxresdefault.jpg,9/10/2021,"Your teamwork pays off in this final stream, and you show your full potential together!",FALSE,FALSE,TRUE,FALSE,TRUE,https://www.youtube.com/watch?v=fxixCZU5aoY
It's been a WAHnderful Year!!!! #WAHnniversary,https://i3.ytimg.com/vi/q-zHTI7kiM8/maxresdefault.jpg,9/11/2021,"It really has been a WAHnderful year! (Though, the mental damage you suffered from watching your debut stream probably wasn't all that wahnderful...) Congratulations on your 1st debut anniversary! May you achieve much this year as well, we'll be here to support you every step of the way!",TRUE,TRUE,FALSE,FALSE,FALSE,https://www.youtube.com/watch?v=q-zHTI7kiM8
【1 YEAR ANNIVERSARY】A Whole Year of...!?!? #Mythiversary,https://i3.ytimg.com/vi/bZghtnL3y3k/maxresdefault.jpg,9/12/2021,"Hey, that's today! ... Probably. Maybe. Or was it yesterday? Or a few days ago?... Anyway, congratulations to you and Myth on your first debut anniversary! Thank you for all your hard work, and we'll be sure to support all of you from now on too!",TRUE,TRUE,FALSE,FALSE,TRUE,https://www.youtube.com/watch?v=bZghtnL3y3k